{
  "$schema": "http://json-schema.org/draft-07/schema#",
  "$id": "https://debloater.hakeemify.com/schemas/profile.schema.json",
  "title": "Profile",
  "description": "A named selection policy. A profile filters what the engine may propose; it never overrides a dont_touch decision and never lifts the destructive exclusion from the safe plan.",
  "type": "object",
  "additionalProperties": false,
  "required": ["id", "title", "include_risk", "exclude_destructive"],
  "properties": {
    "id": {
      "type": "string",
      "pattern": "^[a-z0-9]+(-[a-z0-9]+)*$"
    },
    "title": { "type": "string", "minLength": 1 },
    "include_risk": {
      "description": "Risk levels this profile is willing to include.",
      "type": "array",
      "minItems": 1,
      "uniqueItems": true,
      "items": {
        "type": "string",
        "enum": ["safe", "low", "medium", "high"]
      }
    },
    "exclude_destructive": {
      "description": "Whether destructive tweaks are excluded. The safe profile must set this true.",
      "type": "boolean"
    },
    "tweaks": {
      "description": "Explicit tweak ids this profile always considers, in addition to what the engine recommends.",
      "type": "array",
      "uniqueItems": true,
      "items": {
        "type": "string",
        "pattern": "^[a-z][a-z0-9]*(\\.[a-z][a-z0-9_]*)+$"
      }
    },
    "params": {
      "description": "Parameter overrides keyed by tweak id.",
      "type": "object",
      "propertyNames": { "pattern": "^[a-z][a-z0-9]*(\\.[a-z][a-z0-9_]*)+$" },
      "additionalProperties": {
        "type": "object",
        "propertyNames": { "pattern": "^[a-z][a-z0-9_]*$" }
      }
    },
    "description": { "type": "string" }
  }
}
